developer,sur_trafic,sur_school,sur_environment,sur_business,sur_entertain,peoperty_fee,property_company,id
珠海市启光房地产开发有限公司,临近金海大桥、洪鹤大桥金湾落脚点，享受未来快捷交通及横琴发展之利,东临示范性普通高中、珠海目前硬件设备较高的广东实验中学珠海金湾校区（金湾一中），区域内还有金湾区外国语学校（原金湾二小）、金海岸中学、海华幼儿园等教育配套,位于金湾航空城南侧，作为临近金湾航空城、金湾高尔夫、金湖公园三大规划的生态居住区，航空城南片区不仅可借势航空城国际化规划与日新月异发展的红利实现跨越式发展，更因临近金海大桥、洪鹤大桥金湾落脚点，享受未来快捷交通及横琴发展之利。 项目北临珠海的生态湿地公园—金湖公园，可近距离享受其丰富的生态观光、康体健身、餐饮休闲之便；南临已经开业的三级甲等综合性医院—广东省人民医院珠海医院 (金湾中心医院)，近距,项目沿街布局商业配套，满足业主日常生活需要,金湾航空城、金湾高尔夫、金湖公园三大规划的生态居住区，小区配置园林泳池、健康跑道、老人康体与儿童娱乐场、会客厅等设施，满足业主日常社交、娱乐健身需要；园林配备多项智能化社区管理系统,3.0元/㎡,中海物业,115
珠海高特立商务服务有限公司,608路：拱北～海泉湾    812路：珠海港～平沙    204路：海虹总站～平沙    K7路：吉大～平沙       826-2：海泉湾-吉大,平沙中心幼儿园，华丰小学，平沙实验小学，平沙一中（初中），珠海一中（平沙校区）,优质高中、初中、小学、幼儿园等环伺项目左右，周边有医院、市场、酒店，大型商业和特色商街，旅游度假资源环绕，品山、观海、享温泉，居家就像度假！,独立商业，农贸市场，钰海国际广场,阿米高影剧院，星光酒吧，台湾风情街，鑫宝丽KTV、K立方等,2.5元/㎡,珠海文德商业经营管理有限公司,1262
恒隆开发,海陆空全维度贯穿，城市对外交通起点，粤港澳都会圈中枢快速接驳三轨（广珠城轨珠机支线、广佛江珠城轨、广珠铁路）、五路（西部沿海高速、江珠高速、机场高速、机场北路、机场东路）、五桥（港珠澳大桥、珠海大桥、香海大桥、洪鹤大桥、金海大桥）、五机场（珠海机场，澳门国际机场、香港国际机场、深圳国际机场、广州国际机场），广东重要港口高栏港，城市东西快速公交（BRT），形成海陆空立体交通网络。,航空小学，航空幼儿园，金湾一中、广东科学技术职业学院、珠海城市职业技术学院、珠海市实验中学、拟建及规划中增加2所中学，4所小学，7所幼儿园,环拥航空城小学、金湾一中、实验中学、吉林大学珠海学院、遵义医学院、省高职院、市城职院，精英教育同步国际；毗邻三甲医院广东省人民医院珠海医院（金湾中心医院），顶尖医疗为生活护航；国际商务中心、市民艺术中心、产业服务中心、公共文化中心、珠海奥体中心、青少年妇幼儿童娱乐中心、近享金湾航空新城规划展览馆、金湾区美术馆等文化设施。,金湾航空新城占地3.8平方公里，由新加坡“规划之父”刘太格倾力打造，构筑山、海、湖、城相融的水上滨海花园城市，将建成汇聚国际商务中心、市民文化中心、产业服务中心“三大中心”，2滨水景观带，滨湖景观长廊，满足行政、商业、酒店、办公、休闲、会展、创新等各种功能的高端核心区域。,紧邻10万㎡大型公园、中心河沿岸绿化景观、金湖公园、湿地公园，营造鲜氧无比的生态休闲公共空间；,2.9元/㎡,恒隆物业,1291
珠海市德泰投资发展有限公司,海陆空全维度贯穿，城市对外交通起点，粤港澳都会圈中枢快速接驳三轨（广珠城轨珠机支线、广佛江珠城轨、广珠铁路）、五路（西部沿海高速、江珠高速、机场高速、机场北路、机场东路）、五桥（港珠澳大桥、珠海大桥、香海大桥、洪鹤大桥、金海大桥）、五机场（珠海机场，澳门国际机场、香港国际机场、深圳国际机场、广州国际机场），广东重要港口高栏港，城市东西快速公交（BRT），形成海陆空立体交通网络。,金湾一中、广东科学技术职业学院、珠海城市职业技术学院、珠海市实验中学、拟建及规划中增加2所中学，4所小学，7所幼儿园,环拥航空城小学、金湾一中、实验中学、吉林大学珠海学院、遵义医学院、省高职院、市城职院，精英教育同步国际；毗邻三甲医院广东省人民医院珠海医院（金湾中心医院），顶尖医疗为生活护航；国际商务中心、市民艺术中心、产业服务中心、公共文化中心、珠海奥体中心、青少年妇幼儿童娱乐中心、近享金湾航空新城规划展览馆、金湾区美术馆等文化设施。,金湾航空新城占地3.8平方公里，由新加坡“规划之父”刘太格倾力打造，构筑山、海、湖、城相融的水上滨海花园城市，将建成汇聚国际商务中心、市民文化中心、产业服务中心“三大中心”，滨水景观带，滨湖景观长廊，满足行政、商业、酒店、办公、休闲、会展、创新等各种功能的高端核心区域。,紧邻10万㎡大型公园、中心河沿岸绿化景观、金湖公园、湿地公园，营造鲜氧无比的生态休闲公共空间；,3.0元/㎡,珠海市铭基物业管理有限公司,1356
珠海市裕沙房地产开发有限公司,"803,Z125。Z108",天姿幼儿园，三灶中心小学，三灶中学。,列圣山森林公园.伟民广场.唐人街市场,唐人街市场，嘉珠时代广场,列圣山森林公园.伟民广场.唐人街市场，嘉珠时代广场,3.0/㎡,时代物业,26
个人产权,往市区：交通：201、K9（香洲）、504（井岸）、801、803、      （三灶环线）Z101、Z104、Z108、Z125,三灶中心小学、三灶中学、吉林大学珠海校区、遵义医学院珠海校区、珠海市职业技术学院、珠海市实验中学高中部、,位于三灶最繁华地区，周边配套齐全，生活非常便利。,唐人街市场、得一超市、万家美购物广场、麦当劳、肯德基（益百家）、红叶美食广场、鹏泰购物广场、中影傲视电影城、三灶文化中心、格林豪泰酒店、七天连锁酒店、四大银行、银柜量版式KTV、鸿银之星卡拉OK厅等,唐人街市场、得一超市、万家美购物广场、麦当劳、肯德基（益百家）、红叶美食广场、鹏泰购物广场、中影傲视电影城、三灶文化中心、格林豪泰酒店、七天连锁酒店、四大银行、银柜量版式KTV、鸿银之星卡拉OK厅等,0.0/㎡,,61
珠海拓茂房地产开发有限公司,珠海大桥、香海大桥（在建）、洪鹤大桥（在建）、金海大桥（在建）、广佛江珠轻轨（规划）,建发幼儿园（在建）、金茂幼儿园（规划中）、中铁建幼儿园（规划中）、金茂小学（在建）、恒大小学（在建）、市一级齐正小学,生态配套：幸福河湿地公园（在建）、尖峰山公园、黄杨河河畔公园（在建）、云峰公园（在建）医疗配套：社区医疗服务中心（在建）、西部医疗中心（在建）、遵医五院、广东省人民医院珠海医院,家和城商场、深圳岁宝（在建）、华发商都（在建）、上海&#183;豫园商城（待建）5万平高端商务体（待建）,1.5万平邻里中心，5万平高端商务体，8.5万平星空主题公园，生态湖景,3.0元/㎡,金茂物业,2094
中联国际租赁有限公司,香海大桥 斗门汽车客运总站,东和小学，城东中学,东堤北湿地公园  白藤湖  黄杨河 尖峰山公园,大信新都会， 大润发， 井岸步行街,金台寺 御温泉 宋城  斗门清朝古街,3.0元/㎡,鸿基物业,2154
珠海复粤实业发展有限公司,珠海大桥、洪鹤大桥、香海大桥（在建）、金海大桥（在建）、广佛江珠轻轨（规划）,建发幼儿园（在建）、金茂幼儿园（规划中）、中铁建幼儿园（规划中）、金茂小学（在建）、恒大小学（在建）、市一级齐正小学,生态配套：幸福河湿地公园（在建）、尖峰山公园、黄杨河河畔公园（在建）、云峰公园（在建）医疗配套：社区医疗服务中心（在建）、西部医疗中心（在建）、遵医五院、广东省人民医院珠海医院,家和城商场、金湾华发商都、深圳岁宝（在建）、上海&#183;豫园商城（待建）,1.5万平邻里中心，5万平高端商务体，8.5万平星空主题公园，生态湖景,3.0元/㎡,高地物业,2104
珠海经济特区侨海工贸有限公司,项目门口：602路（香洲-五山沙龙）、K6（香洲-五山沙龙）  406路407路（井岸-井岸）,五山中心幼儿园、五山中心中学、富山中心幼儿园、富山一幼一小（在建）、荔山幼儿园、珠海新徽实验学校、珠海中学(在建),富山产业新城初步投资145个亿打造大型富山产业新城居住区乾务镇卫生院、斗门区人民医院、遵义医科大学第五附属珠海医院1乾务南山村卫生站、富山新荔门诊部，农商银行、交通银行,和大福百货、佳乐购物广场、荔山商业广场、嘉润百货、永盛百货、万家福购物商场、龙兴百货,项目外围修建了近500米的山体护坡绿化走道、斗门公园、金台寺、御温泉、黄杨山森林公园、珠海耀朗高尔夫俱乐部,2.5元/㎡,开发商物业,1289
珠海德昌房产有限公司,坐301、503、504、601、601B、602、602A、609、K4、K5路公交车到德昌盛景巴士站,康裕幼儿园、西江月幼儿园、城南小学、城南中学、科技学院、吉林大学,德昌盛景位于珠海西城核心湖心路。项目总用地面积近6.4万平方米，总建筑面积近25万平方米，建筑密度仅为20%，容积率3.4，绿化率高达42.3%，由11栋18-28层高层住宅围合而成，共2275户优雅人家。,新万家福超市、美宜家、华润万家、万家美超市,白藤山公园、白藤湖度假村、鳄鱼岛、御温泉、金湾高尔夫,1.5元/㎡,珠海市恒安达物业管理有限公司,92
广银集团,★项目紧邻机场北快线 (北段建设中) ，约7分钟车程可达珠峰大道；经双湖路后，约15分钟车程可达金湾航空新城，约30分钟可达金湾机场，通过香海高速约30分钟车程可达香洲，横琴通过港珠澳大桥的无缝对接，将全面融入1.5小时粤港澳大湾区生活圈,【学校】离项目400米可达斗门四中 (公办) ，离项目1公里可达井岸一小 (市一级) ，离项目2公里可达井岸镇中心幼儿园 (省一级) ，离项目2公里可达东风小学。,井岸镇是斗门区的镇中心，拥有百年历史，常驻人口超20万人，居住生活氛围浓厚。★新城片区总规划面积10.68平方公里，规划城市建设用地9.51平方公里，人口17万人。★井岸新城位于珠海西部中心综合服务组团，规划定位为滨江田园特色的生态宜居片区。★随着新城崛起，片区价值提升，人口和经济逐步往新城涌动,★【商业配套】2公里近享井岸老城配套，约700m远的坭湾市场举步即达，约10分钟车程可达斗门万达广场 (预计2024年开业) ，约15分钟车程可达斗门大信新都汇、井岸步行街等繁华商圈。湾区首座4.0版万达广场 (24年开业) 距离项目约3.6公里，约10分钟车程即可达到。,【公园配套】离项目约1公里可达霞山公园，约3公里可达尖峰山公园、斗门市民公园及黄杨河湿地公园等,3.0元/㎡,广银物业,2296
珠海金碧房地产开发有限公司,交通亦非常便利，门口就有公交巴士站，中纺城站。如果您自驾车沿白蕉路往东行驶可快速到达斗门中心及湖心路口片区，湖心路口作为珠海东西区交通枢纽转接口，也是西部生态新城中心地带；沿白蕉路往西行驶，可快速到达西部沿海高速、，江珠高速，轻松到达整个珠三角及粤西地区。沿着连桥路往北行驶可快速到达井岸中心区域；往南行驶可快速到达井岸商业中心，生活购物非常便捷。,幼稚园、小学，中学，市场、超市，银行一应俱全。,誉城花园项目又位于斗门区重点镇-白蕉，目前市政重点投入发展此区域，各大品牌开发商都纷纷拿地开发，像华发、万科、金地、招商、时代等，此时的白蕉片区已全然不同。而我们誉城花园的位置是生活配置最为齐全的区域，周边幼稚园、小学，中学，市场、超市，银行一应俱全。交通亦非常便利，门口就有公交巴士站，中纺城站。如果您自驾车沿白蕉路往东行驶可快速抵达到达斗门中心及湖心路口片区，湖心路口作为珠海东西区交通,沿着连桥路往北行驶可快速到达井岸中心区域；往南行驶可快速到达井岸商业中心，生活购物非常便捷。,沿着连桥路往北行驶可快速到达井岸中心区域；往南行驶可快速到达井岸商业中心，生活购物非常便捷,2.5元/㎡,珠海市金碧丽江物业服务限有公司,38
珠海市坭湾五洲东方墅房地产开发有限公司,303路、307路、405路、502路、601B路、602路、602A路、K6路公交车,实验小学、实验中学、华发容闳国际幼稚园、珠海理工学校,位于斗门区珠峰大道尖峰南侧，邻近斗门区新行政中心，北依省级森林公园尖峰山公园，南靠14公里黄杨河，毗邻省级湿地公园--华发水郡湿地公园,名典咖啡、东方食府、雙玲瑜伽馆、如煊健身会所、万象城超市、盈亨酒店、华润万家超市、新鲜蔬果市场、各色餐饮店等,南靠14公里黄杨河，毗邻省级湿地公园--华发水郡湿地公园,2.2元/㎡,珠海市五洲湾花园物业服务有限公司,45
珠海雍景华越房地产有限公司,,规划12班幼儿园，24班小学，30班初中（直线距离650米),西城之芯、5分钟繁华配套圈32公顷湿地公园、8大主题景观,4万平豫园商城（350米）家和城商业广场,32公顷湿地公园、8大主题景观8万平星空公园,3.0元/㎡,华发物业,2175
珠海市方乾房地产开发有限公司,珠海斗门汽车客运站，距离本项目约1.7公里（已运营）；田家炳中学站，目前已有307、520a、520、603、b37、b38线路运营，其中307路可至斗门主城区，520a、520、b37、b38路可至金湾主城区，603路可至香洲吉大站；,现有东和小学（建校1927，近期政府规划翻新中）、城东中学、田家炳中学；此外白蕉片区规划幼儿园5所、小学3所、初中2所，规划小学学位4320个，规划初中学位3000个；,东堤北湿地公园  白藤湖  黄杨河 尖峰山公园,项目驱车约8min可达区域最繁华商业—大信新都汇；项目自有约2500㎡商业业态;招商约7.3万㎡大型商业体预计2023年初开业;板块还将新增约3000㎡商业街区，城市繁华一步到位,1、三广场八公园，乐享一河两岸滨水资源；三广场： 黄杨休闲广场、河畔广场、裕泽海滨广场(东堤极限运动公园)；八公园：西堤公园、扬帆公园、黄杨河湿地公园、凤山公园、云峰公园、尖峰山公园，益和城市公园、霞山公园；其中凤山公园，益和城市公园，都距离项目不到3公里；2、斗门区文化艺术中心，包括文化活动中心、中央图书馆、融媒大厦等，预计2023年底完工；3、宋城演艺旅游度假区；,3.0元/㎡,方直心生活服务集团,2228
金碧丽江房地产,湖心路、珠海大道快速通达全市，江珠高速、京珠高速、广珠城轨轻松实现珠三角便捷生活。,乐思幼儿园，齐正小学，城南学校、红旗中学，珠海城职学院，珠海艺术学院，广东科干学院,金湾立交多维立体交通，瞬达全市！地处西部中心城区A片区核心，定位珠海西部主城区！东南亚风格，自带8000㎡商业，比邻10万㎡家和城广场商业综合体，一站式醇熟配套！齐正小学、城南学校、红旗医院、西部医疗中心等教育、医疗齐全！,自带8000㎡多的商业，比邻10万㎡家和城广场商业综合体，一站式醇熟配套！,自带8000㎡多的商业，比邻10万㎡家和城广场商业综合体，中影佰纳影院、金湾高尔夫、鳄鱼岛酒吧街、飞沙滩、御温泉度假村、斗门古街等,2.5元/㎡,金碧丽江物业,1315
珠海市昱晖房地产开发有限公司,项目沿河段交通路况已基本完善，通车在即，项目东侧为成裕巴士站和益力集团巴士站，经过该站的公交车线路为306路（白蕉长途客运站——北澳），前往本项目可在成裕巴士站下车。珠海市区方向：乘坐603、601、609、602、K5、K4、K6等在鳄鱼岛下车，到尖峰桥东站乘坐306公交至成裕巴士站，前行100米井岸方向：乘坐306公交至成裕巴士站，前行,有联厂小学；初中：城东中学,珠澳大桥成就世界珠海，内陆唯一与港澳同时连接的城市；位处西部中心城区的核心位置，,大信新都会,教育	蓓蕾艺术幼儿园、白蕉镇中心幼儿园、成裕围小学、白蕉中心小学、联厂小学、城东中学、田家炳中学、井岸青少年宫购物/超市	自身商业街、华润万家、百惠购物中心、千惠百货、永发优惠商城、华美超市、井岸步行街、大信新都汇（在建）市场	金山市场、白蕉中心市场、城东市场、东湖市场、白藤湖市场医院	遵义五院、侨立中医,3.0元/㎡,时代物业,1292
珠海协通房地产开发有限公司,立体的三横三纵交通路网优势（三横：珠海大道、珠峰大道、西部沿海高速，三纵：珠海机场高速、双湖路、高栏港高速），真正实现港澳便捷生活圈。 通过高栏港高速30分钟直通高栏港经济区，通过双湖路连接珠海大道15分钟畅达金湾 通过机场高速20分钟可抵达珠海国际机场，通过西部沿海高速半小时可以到达中山江门，一个小时左右即可以到达广州、佛山等地 除此外项目西南处有一块公共交通用地，明确规划为公交总站，海陆空多维,名门学府环伺，项目除了内部将自建一所幼儿园之外，乾务中心小学、乾务中心幼儿园、华中师范大学附属中学等省一级教育配套，全龄段教育，让孩子就学更方便。,项目位于珠海西部文旅生态中芯，聚集了医疗、教育、购物、娱乐休闲的活力城市生活圈。居于此，繁华繁花相融共生，一处生态宜居大境自此绘就。行政核心：靠近政务中心板块，斗门区人民法院、斗门区税务局、斗门区人民检察院，尖峰，市民生活更便捷。 商业核心：项目周边范围内，更有千亿城市配套。只需几脚油门，繁华便近在咫尺：大信富元广场（建设中，建面约4.86万㎡）、还有首驻斗门的万达广场（规划中，建面约12,项目周边范围内，更有千亿城市配套。只需几脚油门，繁华便近在咫尺：大信富元广场（建设中，建面约4.86万㎡）、还有首驻斗门的万达广场（规划中，建面约12.4万㎡）。,市民公园（规划中，建面约5.6万㎡）、黄杨河湿地公园（建面约40㎡）、尖峰山公园（建面约17.1万㎡）等多公园环绕，出门进园，生态自然融进生活里。,3.0元/㎡,星河智善生活集团,2270
珠海市斗门区新堂福隆房产开发有限公司,香海大桥（已通车）洪鹤大桥（已通车）金海大桥（在建中）广佛江珠轻轨（规划中）,金茂中小学（华中师范附属中小学）（已开学）中铁建地块在建12班幼儿园、36班小学中铁建地块18班幼儿园（已开学）建发地块在建12班幼儿园,1. 生态景观：双市政公园环绕——8.5万㎡白藤市民公园，32万㎡幸福河湿地公园，打造科学环保，特色鲜明的生态系统，在忙碌的生活中体验闲暇的欢愉时光。2. 三大商业体围绕：家和城广场、豫园商城、金茂商城，拥醇熟城心，享受繁华商业配套。3. 百亿配套：15分钟车程直达华发国际商务中心，金湖公园，金湾高尔夫球场，西湖湿地公园，西部城区市级体育中心，产业服务中心等百亿配套环绕。4. 全龄段教,自身配套0.4万㎡高端商业建发地块在建约1.4万㎡凤舞云街复星地块规划约3万㎡豫园商城，将引入10家中华老字号品牌商家进驻金茂地块规划约6.5万㎡主题式商业街区家和城广场内含嘉荣超市、儿童天地、约4000㎡国际影城,白藤市民公园（在建中）幸福河湿地公园（在建中）尖峰山公园白藤山湿地公园,3.0元/㎡,万科物业,2127
珠海颐泽企业管理有限公司,一桥主城立体交通畅行湾区招商华发湖心明荟坐拥湖心路、双湖路双主轴，雄踞珠海大桥、香海大桥（预计2022年通车）桥头堡,乐思国际幼儿园、齐正小学、城南中学、红旗中学，规划12班幼儿园，24班小学，30班初中,西城之芯、5分钟繁华配套圈32公顷湿地公园、8大主题景观,家和城商业广场,32公顷湿地公园、8大主题景观8万平星空公园,3.0元/㎡,海伦堡物业管理有限公司,2251
珠海市恒基房产开发有限公司,交通公交：406路、407路、419路（富强中站）、416路（坚士制锁站），沿富强十路直行150米至项目入口，右转直行到达项目自驾：珠峰大道或西部沿海高速——高栏港高速辅路——富强十路——五洲富山园项目,乾务镇第二中心幼儿园、三村幼儿园、新村幼儿园、五山中心幼儿园中小学乾务五山中心小学、五山中学,自建2.2万平商业综合体，米夏村市场、马山市场御温泉度假区、海泉湾度假区、斗门古街、金台寺、市政公园（建设中）珠海市第五人民医院，斗门富山门诊部,自建2.2万平商业综合体，米夏村市场、马山市场,五洲富山园，打造富山片区稀缺高品质住宅、商业小区，满足居民商务、居住、购物、娱乐需求。五洲富山园园林风格定义为现代主义风格，设计上重视空间格局，彰显都市感和现代感，打造简约淡雅、自然清新的居住环境。配件2.2万㎡一站式商业，高端购物商场、品牌餐饮、娱乐、休闲等精彩汇聚，幅射周边8公里，覆盖消费人群过万。并精心打造数万平米运动休闲湿地公园，全龄居住社区，包含儿童活动、羽毛球场、篮球场、青年活动、老年,2.0元/㎡,和美物业管理服务有限公司,2129
时代中国,交通可乘坐603、601、601B、602、602A、609、504、301、503共9条公交路线到达东方威尼斯站下车即可到达项目,白藤湖中学、白藤湖中心小学 本项目配套幼儿园、颖星幼儿园(白藤三路) 、西江月幼儿园 ,市西进首站，金湾立交多维立体交通，瞬达全市！地处西部中心城区A片区核心，定位珠海西部主城区！24万㎡高品质生态人居社区，5000㎡特色商业步行街，比邻10万㎡家和城广场商业综合体，一站式醇熟配套！齐正小学、城南学校、红旗医院、西部医疗中心等教育、医疗齐全！,家和城广场、华润万家、百惠购物中心、千惠百货、永发优惠商城、华美超市,中影佰纳影院、金湾高尔夫、鳄鱼岛酒吧街、飞沙滩、御温泉度假村、斗门古街等,2.5元/㎡,万科物业,1259
珠海市恒裕地产开发有限公司,交通可乘坐603、601、601B、602、602A、609、504、301、503共9条公交路线到达东方威尼斯站下车即可到达项目,白藤湖中学、白藤湖中心小学 本项目配套幼儿园、颖星幼儿园(白藤三路) 、西江月幼儿园 ,46万㎡大盘 坐拥500亩生态湿地公园 白藤湖一河两岸自然景观近8万㎡高端商业配套+5000㎡业主私人会所位于湖心路主干道，约9条公交线路,本项目配套商业、家和城广场、华润万家、百惠购物中心、千惠百货、永发优惠商城、华美超市 ,规划有集中式商业、会所、泳池、幼儿园、户外水岸舞台、儿童游乐园、休憩区、下沉式水池、中庭湖泊、休闲运动广场 ,2.6元/㎡,丹田物业公司,77
珠海景华房地产有限公司,一桥主城立体交通畅行湾区招商华发湖心明荟坐拥湖心路、双湖路双主轴，雄踞珠海大桥、香海大桥（预计2022年通车）桥头堡位置，跨桥速达主城。周边珠三角环线高速、广佛江珠高速等快线环绕，更有广州城际、金湾机场等立体路网，近享两小时湾区生活圈。横跨珠海东西部——香海大桥香海大桥（预计2022年通车），“连通南北，横跨东西”，香海大桥连通西部城区与香洲城区，香海大桥通车将加速东西,规划12班幼儿园，24班小学，30班初中（直线距离650米),西城之芯、5分钟繁华配套圈32公顷湿地公园、8大主题景观,4万平豫园商城（350米）家和城商业广场,32公顷湿地公园、8大主题景观8万平星空公园,3.0元/㎡,华发物业,2221
