developer,sur_trafic,sur_school,sur_environment,sur_business,sur_entertain,peoperty_fee,property_company,id
珠海民商互联网金融大厦开发有限公司,①港珠澳大桥横跨三地，直达香港，其中一个出口设在横琴，其余出口设在南湾立交和洪湾立交，横琴亦成为唯一陆路连接港澳两地的自贸区。②珠海城际轻轨起点设在拱北轻轨站，首期在横琴设三个站点（金融岛、口岸、长隆），直达拱北，其中口岸站将无缝连接澳门轻轨。,横琴小学、横琴幼儿园、横琴学校（九年一贯制）、横琴一中、澳门大学横琴校区,项目位于横琴大桥南侧，处于“三片十区”中的中央商务区。该区以金融、商务服务为代表的现代产业体系在中央商务区成为重要发展导向，依靠港澳注入顶尖的企业，将打造成大陆金融对外开放的新窗口。目前中央商务区内的写字楼项目有高金中国总部，南方国际金融传媒大厦、横琴国际金融中心大厦、中交金融大厦、中国铁路金融大厦等,横琴进口商品展销体验中心,长隆海洋度假区、小横琴山森林公园、大横琴山森林公园、天湖自然风景区、横琴蚝生态园、湾仔竹仙洞等旅游景点,0.0元/㎡,,114
富力地产,公交路线：Z30，K11，14，61，86。附近有港珠澳大桥，金琴快线落脚点，项目东经南湾大道或者加林山隧道可方便到达主城区各区域，快速接驳广珠轻轨珠海站、九州港码头；南面与横琴自贸区仅一桥之隔，经马骝洲水道（2017年11月13日已贯通，2018年夏季通车）或横琴大桥过横琴口岸再进入澳门。未来洪鹤大桥的建成将拉近保税区与金湾西湖城区的距离，共享区域升值，快速即可到达金湾机场。,保税区第一小学、保税区中学。保税区规划配建3处幼儿园，除居住配套区中部的幼儿园独立占地外，其他2处幼儿园均为附设，分布在中部居住小区和连屏居住小区； 规划小学1处，位于居住配套区A204a03管理单元，规模为36班；规划初中1处，位于居住配套区A204a03管理单元，规模为24班。,项目所在保税区北靠黑白面将军山，南临马骝洲水道，自然景观条件优越。情侣西路马骝洲水道景观带，景观环境良好、舒适宜人。人气兴旺的滨水景观带以山为脉、以水为形，形成多条通廊、层次丰富、立体化的开放空间体系。合理的空间布局，互动的城市功能，独具特色的地标空间，多元化的景观环境和多元人文特色的社区，让这里的街区具有尺度宜人和舒适的步行环境。,富力优派商业广场附近，在宝顺路南侧，宝利路西侧规划配建1处一级邻里中心，用地面积为14080平方米，用地性质为商业设施、文化设施和公共交通设施混合功能用地。包含主要功能为肉菜市场、社区商业设施、居住区级文化中心、公交首末站、门诊部和一级邻里中心其他功能。,可以去湾仔旅游码头，国际会展中心，湾仔海鲜街，同时保税区规划居住区公园有3处，其中南湾大道东门户区1处、莲屏村居住区1处、横琴第三通道以西、宝南路以南1处；规划有小区游园2处，分别位于宝顺路南侧和宝南路南侧临马骝洲水道；规划有1处市民广场，位于南湾大道东门户区，面积为2.17公顷。整体城市设计、建设兼具保税物流与商业商贸、滨水居住功能为一体的山、水、城、绿相互交融、层次分明、疏密相宜、网络高效的滨,5.0/㎡,天力物业,1156
横琴巨汇投资有限公司,交路线：Z30，K11，14，61，86。附近港珠澳大桥，金琴快线落脚点，广珠西线,湾仔小学，湾仔中学，横琴小学，横琴中学,项目周边主要为保税区内企业及改造项目，东侧近横琴大桥，西侧横琴二桥及在建的马溜洲隧道，北面紧邻西线高速，珠三角环线高速。,华发商都，华发世纪城，横琴境内商业,湾仔旅游码头，国际会展中心，湾仔海鲜街，喜来登酒店，横琴长隆海洋公园,4.5/㎡,珠海市宇轩物业管理,1240
珠海市哈希网络科技有限公司,62，86，14，61，Z30，K11,湾仔小学，湾仔中学，横琴小学，横琴中学,富力&#183;泰禾&#183;奥园等品牌小区环围，港珠澳大桥落脚点，,三口岸：项目周边10分钟车程内有三大口岸，横琴口岸、湾仔口岸、拱北口岸，可快速到达澳门。最大商业街十字门CBD商业并且横琴口岸是目前珠海第一个也是唯一一个24小时通关的口岸，保税区与横琴之间一条新的道路——马骝洲海底隧道已全线贯通，10月即将通车。且距离项目仅2分钟，开通后进出横琴将更加便利。项目周边的交通选择性也很多，通过京珠高速，西部沿海高速，港澳高速可以快速融入珠三角各个,横琴长隆，石博园，会展中心,4.8/㎡,保利物业,1222
珠海市碧桂园房地产开发有限公司, 5路（湾仔-凤凰北）;14路（长隆-凤凰北）;60路（湾仔-吉大总站）;61路（保税区-前山总站）;62路（圆明新园-横琴关口）;86路（南屏科技园-长隆）;k10路（吉大总站-长隆）;k11路（香洲汽车站-长隆）；,幼儿园：新源幼儿园，科教中心幼儿园，珠海容闳国际幼稚园；小学：湾仔小学、鸿景小学；容闳小学（华发新城内）；中学：湾仔中学、德威高中等；容闳书院（华发新城内）；,前水背山，紧邻情侣路与前山河，远眺南海，夜晚还可以欣赏澳门夜景。背靠城市绿肺黑白面将军山森林公园，总面积24.75 平方公里，山上的银坑水库为专供澳门水源地,华发新天地，国际会展中心，华发中演大剧院，华发商都，华发新天地，华发中演大剧院、喜来登酒店、希尔顿酒店，铂尔曼酒店、湾仔海鲜街,长隆国际海洋王国，珠海横琴国际网球中心，竹仙洞公园，白面将军山，北山文化广场,4.5/㎡,广东碧桂园物业管理有限公司,20
佳兆业,乘坐5、14、60、61、62、K10路公交车分别在湾仔口岸、鸿景花园站下车均可到达项目,湾仔小学、湾仔中学、南湾幼儿园、典培幼儿园,湾仔医院、中国邮政、湾仔邮局,成德商行、湾仔市场、快乐万家百货,宽记、丰华渔港、百里鲜、海仪美食楼,13.0/㎡,佳兆业,8
珠海保税区利是达置业有限公司,项目交通体系概况1）5分钟直达横琴关口， 24小时通关澳门；2）港珠澳大桥出口200米，30分钟直达香港；3）未来广珠轻轨延长线将接驳至横琴，经由广珠轻轨1小时直达广州；4）30分钟由规划中的深中大桥（2015年年底开工建设，2021年通车），30分钟直达深圳；5）经金海大桥（计划2015年动工建设，2019年通车），20分钟达珠海金湾机场；6）经广珠西线、京珠高速等交通网,澳门大学、横琴小学、耀华国际幼儿园、横琴幼儿园、产学联盟、澳门文化创意园、 北大希望之星实验学校,项目东面澳门西湾、十字门水道、金融岛、十字门国际会展中心、喜来登酒店、瑞吉酒店、希尔顿酒店、华发新天地；南面马骝洲水道、横琴新区和大小横琴山；西面为保税区和马骝洲水道；北面为加林山。,莲邦广场、横琴商业步行街、香洲埠文化院街,游艇产业服务基地、东方高尔夫球场、横琴国际网球中心、长隆度假区、丽新星艺文创天地、横琴滨海湿地修复工程、长隆海洋度假区、小横琴山森林公园、大横琴山森林公园、天湖自然风景区、横琴蚝生态园、湾仔竹仙洞等旅游景点,8.0/㎡,第一太平戴维斯,14
华发,交通横琴口岸、横琴大桥、横琴二桥、珠机城规（建设中）、联澳隧道（规划中）、琴澳轻轨（建设中）、金琴快线等,中小学哈罗公学、容闳公学、威雅公学、横琴一小、横琴一中、横琴幼儿园、伯牙小学、子期幼儿园、子期小学等,横琴金融岛CBD，珠海国际会展中心，小横琴山，大横琴山，澳门,励骏庞都广场，横琴购口岸商业广场，中央汇商业广场、华发广场商业广场、金融岛中央公园商业广场、,长隆海洋王国，星乐度露营小镇，狮门娱乐中心，三叠泉度假中心，紫檀文化博物中心，十里花海长廊，石博园，珠海横琴国际网球中心,3.0元/㎡,华发物业,2297
龙光地产,公交路线：Z30，K11，14，61，86。附近港珠澳大桥，金琴快线落脚点，广珠西线,湾仔小学，湾仔中学，横琴小学，横琴中学,项目周边主要为保税区内企业及改造项目，东侧近横琴大桥，西侧横琴二桥及在建的马溜洲隧道,华发商都，华发世纪城，横琴境内商业,湾仔旅游码头，国际会展中心，湾仔海鲜街，喜来登酒店，横琴长隆海洋公园,4.5元/㎡,龙光物业,1234
华发,交通横琴口岸、横琴大桥、横琴二桥、珠机城规（建设中）、联澳隧道（规划中）、琴澳轻轨（建设中）、金琴快线等,中小学哈罗公学、容闳公学、威雅公学、横琴一小、横琴一中、横琴幼儿园、伯牙小学、子期幼儿园、子期小学等,横琴金融岛CBD，珠海国际会展中心，小横琴山，大横琴山，澳门,励骏庞都广场，横琴购口岸商业广场，中央汇商业广场、华发广场商业广场、金融岛中央公园商业广场、,长隆海洋王国，星乐度露营小镇，狮门娱乐中心，三叠泉度假中心，紫檀文化博物中心，十里花海长廊，石博园，珠海横琴国际网球中心,3.0元/㎡,华发物业,2244
珠海十字门中央商务区建设控股有限公司,&quot;综合交通体系一小时通达湾区。海陆空轨港五维综合交通体系，一小时即可通达湾区；澳门轻轨延长线将连接横琴口岸，现已动工。港珠澳大桥，横琴大桥双跨海大桥，广珠轻轨延长线金融岛站，机场城轨，横琴口岸；珠海机场，澳门机场，香港机场三大机场等涵括海陆空立体交通&quot;							,&quot;1.横琴哈罗礼德公学，已开学；2.容闳公学进驻横琴，已开学；3.横琴子期实验幼儿园（公立），目前已在启用；4.横琴子期实验小学（公立），目前已在启用；5.首都师范大学伯牙小学（公立），横琴新区首次与国家&quot;&quot;双一流&quot;&quot;大学——首都师范大学联姻&quot;&quot;办学，目前已在启用；6.横琴威雅公学，校区目前正在建设中，是横琴第一家国际女子公学；7.澳门大学横琴校区，面积较老校区扩大了约20,横琴金融岛中央公园、十里花海长廊、,励骏庞都广场、横琴购口岸商业广场,珠海横琴长隆国际海洋度假区（由海洋王国、横琴国际马戏城组成）、星乐度&#183;露营小镇、狮门娱乐天地（全球首座狮门影业国际电影主题乐园）、国家地理探险家中心、横琴国际网球中心、横琴东方高尔夫球场、横琴花海长廊（珠海新晋网红打卡点）、芒洲湿地。							,3.0元/㎡,华发,2250
珠海横琴丽新文创天地有限公司,港珠澳直通巴士总站，14路，k10路，89路，Z53路,横琴中小学，哈罗礼德,华发国际网球中心，紫檀博物馆，香洲埠文化院街，横琴万象世界，长隆海洋王国等，彩虹生活广场、来来梦幻世界,彩虹生活广场、来来梦幻世界,华发国际网球中心，紫檀博物馆，香洲埠文化院街，横琴万象世界，长隆海洋王国等，彩虹生活广场、来来梦幻世界,0.0元/㎡,创新方商业管理有限公司,2282
中冶名恒置业有限公司,*项目四至：北依琴海北路，东临千福道，南邻环岛北路，西至千寿道！港珠澳大桥横跨三地，全长为49.968公里，直达香港，已通车，其中一个出口设在横琴，其余出口设在南湾立交和洪湾立交，横琴亦成为唯一陆路连接港澳两地的自贸区。②珠海城际轻轨起点设在拱北轻轨站，首期在横琴设三个站点（金融岛、口岸、长隆），全长约17公里，直达拱北，其中口岸站将无缝连接澳门轻轨。,自带30个班的公立小学，横琴小学、横琴幼儿园、横琴学校（九年一贯制）、横琴一中、澳门大学横琴校区,英国威雅公学、法拉帝游艇亚太中心、长隆国际海洋度假区、东方高尔夫、麻省总院中国医院等国际配套,横琴进口商品展销体验中心,长隆海洋度假区、小横琴山森林公园、大横琴山森林公园、天湖自然风景区、横琴蚝生态园、湾仔竹仙洞等旅游景点,5.5元/㎡,中冶物业  ,1247
珠海市整合置业有限公司,公交路线：Z30，K11，14，61，86。附近港珠澳大桥，金琴快线落脚点，广珠西线,湾仔小学，湾仔中学，横琴小学，横琴中学,项目周边主要为保税区内企业及改造项目，东侧近横琴大桥，西侧横琴二桥及在建的马溜洲隧道,娱乐一体化体验街,湾仔旅游码头，国际会展中心，湾仔海鲜街,5.0元/㎡,碧桂园物业管理有限公司,1300
珠海横琴富昌盛实业发展有限公司,上村巴士公交站（87路 琴海西路总站-前山总站，z51b路横琴口岸西-桂风道路口，z52路向阳东站-深井长隆基地站， ）,横琴幼儿园，横琴小学，横琴一中，哈罗国际公学，伯牙小学,项目对面的横琴检察院，人民法院，市民服务中心，东侧有励骏友谊广场,,励骏友谊广场，南接市政绿化公园，天沐琴台，紫檀文化中心，创新方,6.8元/㎡,第一太平戴维斯,1345
广东新三联投资发展有限公司,①港珠澳大桥横跨三地，横琴亦成为唯一陆路连接港澳两地的自贸区。②珠海城际轻轨起点设在拱北轻轨站，项目周边遍及五大国内、国际机场。广珠城轨延长线横琴新区金融岛站、K11、K10、14、86、62,横琴幼儿园、横琴小学，横琴中学，澳门大学横琴校区,比邻金融岛站，城轨站上物业，一湾双城三江，丰富景观资源，比邻游艇码头，约6万㎡中央公园,励骏商业广场、横琴中央汇,长隆海洋王国,6.6元/㎡,万科物业,1282
横琴万象世界发展有限公司,公公交车路线：港澳大道路口站，车次：14路，86路，K10，K11,澳门大学、横琴小学、横琴中学、横琴幼儿园、产学联盟		,大小横琴山公园，万象公园，横琴湿地公园，北临天沐河,10万平米万象商城,长隆海洋王国东方高尔夫其他规划的休闲娱乐配套（创新方、HELLO KITTY主题乐园、香洲埠等）游艇产业服务基地、丽新星艺文创天地，美国麻省医院、横琴医院、横琴中医药产业基地,7.0元/㎡,华润物业,81
广东珠江投资股份有限公司,①港珠澳大桥横跨三地，全长为49.968公里，30分钟直达香港，其中一个出口设在横琴，其余出口设在南湾立交和洪湾立交，横琴亦成为唯一陆路连接港澳两地的自贸区。②珠海城际轻轨起点设在拱北轻轨站，首期在横琴设三个站点（金融岛、口岸、长隆），全长约17公里，10分钟直达拱北，其中口岸站将无缝连接澳门轻轨。④项目周边遍及五大国内、国际机场。广珠城轨延长线横琴新区金融岛站、K11、K10、14、86、62,澳门大学、横琴小学、横琴幼儿园、澳门文化产业创意园,东面：一线望海，正对澳门半岛，可观澳门塔、新葡京酒店等澳门城市景观，近可看金融岛、国际游艇中心西面：近看横琴大桥、马遛洲景观，远看海面将军山南面：近看北咀山景观，远看小横琴山景观北面：珠海国际会展中心综合体提升十字门片区城市景观,华发广场、横琴商业步行街、香洲埠文化院街、励骏友谊广场,澳门凯撒高尔夫球会、澳门赛马会、新濠影汇度假村、银河酒店、威尼斯人酒店、新葡京酒店、澳门塔、蝙蝠侠主题公园等,0.0元/㎡,康景物业有限公司,1302
珠海琴发实业有限公司,广珠城际轻轨横琴延伸站与横琴口岸无缝隙对接）、湾仔口岸。公交路线：62路、K10、K11、14路、24路、86路。轨道交通：广珠城际轨道（珠海站、横琴口岸站）与澳门轻轨在横琴对接。港口码头：湾仔旅游码头、横琴蚝情码头、福海码头等。高速公路：广珠西线（至佛山和广州）、京珠高速（至广州南沙）、江珠高速（至江门）、西部沿海高速（贯穿珠海、台山、恩平、阳江各市沿海区域）太澳高速、机场高速（,横琴小学、横琴幼儿园、横琴学校（九年一贯制）、横琴一中、澳门大学横琴校区,,横琴进口商品展销体验中心,长隆海洋度假区、小横琴山森林公园、大横琴山森林公园、天湖自然风景区、横琴蚝生态园、湾仔竹仙洞等旅游景点,3.5元/㎡,华发物业,1155
横琴东西汇发展有限公司,公交车路线：港澳大道路口站，车次：Z53路、14路，86路，K10，K11,澳门大学、横琴小学、横琴中学、横琴幼儿园,大小横琴山公园，万象公园，横琴湿地公园，北临天沐河,自带7600㎡免税商场，10万平米万象商城,长隆海洋王国、东方高尔夫、,5.9元/㎡,万科物业,1458
	珠海铁建大厦置业有限公司,珠三角环线高速、广珠西线高速（广澳高速）；珠三角环线高速位于保税区，广澳高速通过横琴二桥接于横琴岛,横琴中学， 横琴小学， 横琴中心幼儿园 澳门大学横琴校区,西北侧是法拉第游艇码头，北侧是金融岛轻轨站，东侧是城市绿地，南侧为汇通三路西北侧是法拉第游艇码头，北侧是金融岛轻轨站，东侧是城市绿地，南侧为汇通三路,励骏商业广场、横琴中央汇,长隆海洋王国,3.0元/㎡,葆力物业管理,1185
新栢嘉（横琴）发展有限公司,通过横琴口岸莲花大桥与澳门直接相连；通过港珠澳大桥与香港相连，一小时车程直达香港；通过发达的公路体系与城轨，门口就是广珠城轨横琴口岸站直达广州、深圳；直达洪湾货运码头、直达客运码头九洲港；经到达珠海机场/澳门国际机场，直达香港国际机场。横琴穿梭巴士：14、62、k10、k11、n20、z50路公交车,横琴小学、横琴幼儿园、横琴学校（九年一贯制）、横琴一中、澳门大学横琴校区,横琴口岸、横琴口岸轻轨站、澳门大学、天沐河、濠江,,长隆国际海洋度假区、三叠泉景区，横琴国际网球中心、香洲埠文化院街、香港丽新“星艺文创天地、法拉帝亚太游艇中心、即将修建的Hello Kitty主题乐园等。,0.0元/㎡,万科物业&amp;戴德梁行,2046
珠海横琴国开投资有限公司,通过莲花大桥与澳门相连，24小时通关澳门，10分钟过关；通过港珠澳大桥与香港相连，港珠澳大桥预计2016年底通车，30分钟车程直达香港；通过发达的公路体系与广珠轻轨，一小时直达广州深圳；5分钟直达横琴湾仔码头、10分钟门渔人码头、20分钟直达客运码头九洲港；20分钟经到达珠海机场/澳门国际机场，40分钟直达香港国际机场，1.5小时达深圳宝安国际机场/广州白云国际机场,横琴小学、横琴幼儿园、横琴学校（九年一贯制）、横琴一中、澳门大学横琴校区,星乐度露营小镇、十里花海长廊、珠海横琴滨海湿地公园,励骏庞都广场、横琴购口岸商业广场、,长隆海洋度假区、小横琴山森林公园、大横琴山森林公园、天湖自然风景区、横琴蚝生态园、湾仔竹仙洞等旅游景点,29.0元/㎡,深圳历思联行物业管理有限公司,18
珠海横琴钜联实业有限公司,粤港澳穿梭巴士首站，巨星汇广场公交站,横琴中小学,横琴中小学，华发国际网球中心，紫檀博物馆，香洲埠文化院街，丽新创新坊，横琴万象世界公园，来来梦幻世界，彩虹生活广场，长隆海洋王国，HelloKitty 主体公园，横琴口岸,钜星汇广场，来来梦幻世界，彩虹生活广场,华发国际网球中心，紫檀博物馆，香洲埠文化院街，丽新创新坊，横琴万象世界公园，来来梦幻世界，彩虹生活广场，长隆海洋王国，HelloKitty 主体公园,13.8元/㎡,金地物业,1198
珠海横琴仁和养生文化发展有限公司,公公交车路线：港澳大道路口站，车次：14路，86路，K10，K11,澳门大学、横琴小学、横琴中学、横琴幼儿园、产学联盟	,大小横琴山公园，横琴湿地公园，三叠泉，珠海长隆国际海洋度假区,创新方，励骏友谊广场，万象世界,长隆海洋王国，东方高尔夫，芒洲湿地公园，狮门娱乐，星乐度横琴露营小镇,4.8元/㎡,仁和三叠泉一号,2014
中冶国际投资发展有限公司,通过莲花大桥与澳门直接相连；通过港珠澳大桥（预计2017年通车）与香港相连，40分钟直达香港；通过发达的公路体系与城轨，两小时直达广州、深圳；5分钟直达洪湾货运码头、20分钟直达客运码头九洲港；20分钟经到达珠海机场/澳门国际机场，40分钟直达香港国际机场。,目前有澳门大学、北大希望之星实验学校、横琴第一中学；未来将按国际标准设置公立幼儿园、小学和中心，引入国际顶尖私立学校,北面为顺景路；东面为琴海东路和澳门；西面为环岛东路和建设中的励骏友谊广场；南面为连通横琴与澳门的莲花大桥,励骏友谊广场、横琴商业步行街（已开业）、周边有28万㎡商业配套，有国际名品Mall、IMX影院、休闲娱乐观光、世界名牌期间商业群、小型精品店,长隆国际海洋度假区、三叠泉景区，横琴国际网球中心、香洲埠文化院街、香港丽新“星艺文创天地、法拉帝亚太游艇中心、即将修建的Hello Kitty主题乐园等。,4.5元/㎡,中冶物业,82
三一(珠海)投资有限公司,通过莲花大桥与澳门直接相连；通过港珠澳大桥与香港相连，直达香港；通过发达的公路体系与城轨，直达广州、深圳；直达洪湾货运码头、直达客运码头九洲港；经到达珠海机场/澳门国际机场，直达香港国际机场。,目前有澳门大学、北大希望之星实验学校、横琴第一中学；未来将按国际标准设置公立幼儿园、小学和中心，引入国际顶尖私立学校,项目北向看澳门景观，南向看小横琴山艺术公园，东看横琴口岸，西看十字门商务区。,励骏友谊广场、横琴商业步行街（已开业）、周边有28万㎡商业配套，有国际名品Mall、IMX影院、休闲娱乐观光、世界名牌期间商业群、小型精品店,长隆国际海洋度假区、三叠泉景区，横琴国际网球中心、香洲埠文化院街、香港丽新“星艺文创天地、法拉帝亚太游艇中心、即将修建的Hello Kitty主题乐园等。,3.0元/㎡,金地物业,1178
富力地产,五大机场：珠海机场（40分钟抵达）；澳门国际机场（40分钟抵达）；深圳宝安国际机场（1小时40份抵达）；香港国际机场（2小时抵达）；广州新白云国际机场（2小时抵达）大桥：港珠澳大桥（预计2017年通车）；横琴大桥（已通车）；横琴二桥（2015年12月已通车）；金海大桥（预计2016年动工）；莲花大桥（已通车）铁路：广珠城际轻轨（预计2016年底通车）高速：广珠西线高速、京港澳高速城,横琴小学、横琴幼儿园、横琴学校（九年一贯制）、横琴一中、澳门大学横琴校区,珠海富力中心位于横琴大桥南侧，处于“三片十区”中的中央商务区。该区以金融、商务服务为代表的现代产业体系在中央商务区成为重要发展导向，依靠港澳注入顶尖的企业，将打造成大陆金融对外开放的新窗口。目前中央商务区内的写字楼项目有高金中国总部，南方国际金融传媒大厦、横琴国际金融中心大厦、中交金融大厦、中国铁路金融大厦等,横琴进口商品展销体验中心,长隆海洋度假区、小横琴山森林公园、大横琴山森林公园、天湖自然风景区、横琴蚝生态园、湾仔竹仙洞等旅游景点,25.0元/㎡,天力物业,6
珠海市横琴好景置业有限公司,横琴口岸物业，往来澳门十分便捷，周边还有湾仔口岸以及拱北口岸，从本项目出发可到达湾仔口岸，可到达拱北口岸；港珠澳大桥落成后，与横琴无缝连接，直达香港；走港珠澳大桥西沿线转广珠西线高速去珠海金湾机场仅；竖向的主干道为金琴高速及通往横琴的环岛东路，直达广州；广珠城际轻轨延长线可直达珠海机场，与澳门实现无缝链接，可直通北上,横琴小学、横琴幼儿园、横琴学校（九年一贯制）、横琴一中、澳门大学横琴校区,华融琴海湾、中海名钻、横琴新家园、华发首府、K2荔枝湾、银鑫花园,励骏广场、华融琴海湾商业街、灏怡天揽商业区、中冶盛世国际广场商业区、横琴口岸商业区,长隆海洋度假区、小横琴山森林公园、大横琴山森林公园、天湖自然风景区、横琴蚝生态园、湾仔竹仙洞等旅游景点,5.0元/㎡,龙光物业,1179
